[
  {
    "schema_version": "glass.event.v0",
    "event_id": "evt_argv",
    "session_id": "ses_matrix",
    "ts_ns": 12,
    "seq": 1,
    "kind": "command_exec",
    "actor": {
      "entity_type": "process",
      "entity_id": "proc_a",
      "resolution_quality": "direct"
    },
    "attrs": {
      "argv": ["deploy", "SECRET_TOKEN", "--internal"]
    },
    "source": {
      "adapter": "fixture",
      "quality": "direct",
      "time_domain": "session_monotonic"
    }
  }
]
