[
  {
    "schema_version": "glass.event.v0",
    "event_id": "evt_home",
    "session_id": "ses_matrix",
    "ts_ns": 11,
    "seq": 1,
    "kind": "file_read",
    "actor": {
      "entity_type": "process",
      "entity_id": "proc_a",
      "resolution_quality": "direct"
    },
    "attrs": {
      "path": "/home/testuser/.ssh/config"
    },
    "source": {
      "adapter": "fixture",
      "quality": "direct",
      "time_domain": "session_monotonic"
    }
  }
]
